title,category,summit,description,date,url
"Banco de la Nación ofrecerá servicios de factoring desde este año, ¿bajarán las comisiones? ",Mercados,El Ministerio de la Producción buscará que más entidades del Estado realicen factoring. ,"En el marco del desarrollo de sistema de facturas negociables, el Banco de la Nación empezará a ofrecer servicios de factoring desde este año. Así lo anunció el Ministerio de la Producción (Produce). “Se viene el factoring con el Banco de la Nación, que por ley tiene la potestad de hacerlo, y estamos trabajando con ellos muy de cerca. En un par de meses estaríamos viendo los primeros resultados. Se avecina muy pronto este año las primeras negociaciones de facturas negociables”, señaló Héctor Chávez, especialista de asuntos financieros del Produce, durante su presentación en la Comisión de Producción del Congreso, en una sesión realizada el pasado 23 de mayo.Al respecto, Ricardo Gallo, presidente de la Asociación Peruana de Factoring, estimó que el Banco de la Nación realizaría factoring con las entidades del Estado que realicen compras. “No veo al Banco de la Nación compitiendo por los compradores privados, pues no tienen cuentas en el Banco de la Nación, salvo la cuenta de impuestos”, indicó.Gallo subrayó que el ingreso del Banco de la Nación al mercado de factoring debería ser como un competidor más. “Pero ello no debe significar que sea el único que haga operaciones de factoring con las entidades del Estado. Eso sería generar un monopolio en una parte del mercado de factoring. Y eso no sería conveniente para nadie”, advirtió. El ingreso del Banco de la Nación al factoring no bajaría las comisiones, ya que el factoring en las entidades del Estado aún es mínimo respecto al factoring en el sector privado, refirió Ricardo Gallo. Según estimaciones de Produce, reportadas en una anterior nota de Gestión, solo el 0.5% del total negociado en facturas corresponde a entidades del Estado.Por ello Gallo sostiene que la gran tarea pendiente en el Estado es que más entidades públicas utilicen el factoring. “Hoy en día son muy pocas las instituciones del Estado que cuentan con las directivas del factoring de una manera clara, que no pongan en riesgo el trabajo del funcionario, que no le genere ningún problema más adelante con alguna auditoría que pueda haber”, anotó. Al respecto, desde Produce indicaron que vienen promoviendo que más entidades del Estado desarrollen directivas internas que viabilicen el factoring. “Cada entidad debe adecuar su normativa interna; por eso, el tener una normativa integral ayudaría mucho para que este proceso se acelere”, señaló Enrique Orezzoli, director de instrumentos financieros del Produce, quien también expuso el 23 de mayo en la Comisión de Producción del Congreso. ",2025-05-29T20:00:00-05:00,https://gestion.pe/economia/mercados/banco-de-la-nacion-ofrecera-servicios-de-factoring-desde-este-ano-bajaran-las-comisiones-noticia/
"Fueron aprobados 87 proyectos mineros por US$ 8,400 millones  tras evaluación ambiental",Economía,"Silvia Cuba Castillo, presidenta ejecutiva del Senace, indicó que los proyectos mineros son los que mayor se presentan a su institución ","Un total de 87 proyectos mineros fueron aprobados hasta mayo de este año, los cuales se encuentra valorizados por US$ 8,400 millones tras evaluación ambiental, reportó el Servicio Nacional de Certificación Ambiental para las Inversiones Sostenibles (Senace).Según Silvia Cuba Castillo, presidenta ejecutiva de la entidad, precisó que el sector minero es el que más proyectos presenta a su institución. Además, indicó que actualmente existen otros 92 proyectos en evaluación por unos 15 mil millones de dólares.Según la funcionaria, el 80 % de los cuales está relacionado con la minería. Estas declaraciones las dio durante su participación en el evento MAQ-MIN 2025, el cual se realizó en la Universidad Nacional Mayor de San Marcos.En otros temas, el viceministro de Minas, Henry Luna Córdova, presentó un balance económico del comportamiento del sector durante los primeros meses del año. Precisó que se alcanzaron 1059 millones de dólares en inversiones, así como también 2611 millones de soles en transferencias.Otros datos que dio fue que se llegó a 6072 millones de soles en recaudación fiscal y 8227 millones de dólares en exportaciones mineras. Asimismo, se generaron 242 mil puestos de trabajo directos.",2025-05-29T20:00:00-05:00,https://gestion.pe/economia/fueron-aprobados-87-proyectos-mineros-por-us-8400-millones-tras-evaluacion-ambiental-noticia/
Sociedad Nacional de Radio y Televisión rechaza ley que obliga a medios conceder el 10% de su franja,Perú,El gremio de medios de comunicación alertó que la medida dictaminada por el Congreso vulnera principios fundamentales de la libertad de expresión y la independencia editorial.,"La Sociedad Nacional de Radio y Televisión rechazó la ley promulgada por el Congreso de la República que obliga a los medios de comunicación a conceder una franja del 10% de su programación para difundir campañas de sensibilización para la prevención de la violencia contra la mujer.A través de un comunicado, el gremio indicó que esta disposición vulnera principios fundamentales de la libertad de expresión y la independencia editorial que los medios de comunicación privados poseen.“La obligación de ceder parte significativa del tiempo al Estado, disfrazada en una noble causa, representa una forma de intervención directa en la línea editorial de los medios. Los medios de comunicación privados tienen el legítimo derecho a definir libremente sus contenidos”, se lee en el pronunciamiento.Asimismo, precisaron que esta imposición representa una amenaza a los principios democráticos, especialmente en el contexto de un proceso electoral que se encuentra en curso.“Instamos al Congreso de la República a derogar esta ley y enfocar sus esfuerzos en construir políticas públicas articuladas que realmente beneficien a la población, en lugar de adoptar medidas que perjudican y debilitan a los medios de comunicación, a los derechos fundamentales y a la democracia”, se añade. “Los medios de comunicación libres e independientes son pilares fundamentales de toda democracia. No permitamos que normas impositivas debiliten este principio”, finaliza el pronunciamiento. ",2025-05-29T20:30:00-05:00,https://gestion.pe/peru/sociedad-nacional-de-radio-y-television-rechaza-ley-que-obliga-a-medios-conceder-el-10-de-su-franja-noticia/
Fiscalía pide al PJ revocar la resolución que ordenó devolver 67 bienes electrónicos a Vizcarra,Política,El expresidente es investigado en el marco del caso ‘Los Intocables de la Corrupción’,"El Ministerio Público pidió a la Corte Suprema que revoque la resolución judicial que ordenó la devolución de 67 bienes electrónicos que le fueron incautados al expresidente Martín Vizcarra.Esto, tras el allanamiento realizado a sus domicilios en Lima y Moquegua el pasado 18 de marzo del 2024, en el marco del caso ‘Los intocables de la corrupción’.Según informó RPP, la Fiscalía apeló la resolución emitida por el juez supremo de investigación preparatoria, Juan Carlos Checkley, quien declaró fundada en parte la solicitud de la defensa del exmandatario. En su requerimiento, alegan que Checkley, al devolverle a Vizcarra los bienes incautados, afectó la motivación de las resoluciones judiciales en su vertiente de incongruencia omisiva, pues solo tomó en consideración que la extracción de información es suficiente para la labor pericial, cuando en realidad solo es un paso para posteriormente elaborar un informe pericial.También advirtieron que, con esta decisión, se imposibilitó a la Fiscalía alcanzar las finalidades de las diligencias preliminares.Frente a ello, la Sala Penal Permanente de la Corte Suprema, que lidera el juez César San Martín, resolvió conceder el recuso de apelación al cumplirse los presupuestos procesales para ser admitido. En su momento se programará la fecha y hora de la audiencia a fin de escuchar a las parte involucradas.De acuerdo con la tesis fiscal, la organización criminal ‘Los intocables de la corrupción’ tenía como fin el promover lobbies ilícitos para apropiarse de dinero del estado a través de contrataciones públicas fraudulentas en Provías Descentralizado.Un colaborador eficaz narró a la Fiscalía que Vizcarra habría recibido dinero producto de las coimas en Palacio de Gobierno. El encargado de llevar los montos de dinero fue Carlos Revilla, exdirector de Provías Descentralizado.“He podido presenciar como el señor Carlos Revilla, en ese momento director de Provias Descentralizado, ha ingresado a Palacio de Gobierno llevando maletines deportivos (dos oportunidades) y un tubo para guardar planos (una oportunidad). El ingreso fue por la puerta Perú y no debía haber registro, todo era orden de Vizcarra”, se lee en la resolución que autorizó la detención de estas personas.Según el informante, Revilla llevó el dinero al expresidente hasta en tres oportunidades. En la primera entrega, realizada en el año 2018, el extitular de Provías ingresó directamente hasta el despacho presidencial y todo fue observado por la extrabajadora de Palacio, Karem Roca.“Karem Roca observó que Carlos (Revilla) llevaba un maletín color negro marca Adidas, conteniendo bultos en su interior, el cual después de 20 o 30 minutos de reunión con Martín Vizcarra se retiraba de su oficina, para luego inmediatamente Karem Roca procedió a ingresar al despacho presidencial y acomodar las cosas personales de Vizcarra, donde observó el maletín que había dejado Revilla”, se lee en el documento.",2025-05-29T19:41:47-05:00,https://gestion.pe/peru/politica/fiscalia-pide-al-poder-judicial-revocar-la-resolucion-que-ordeno-devolver-67-bienes-electronicos-a-martin-vizcarra-noticia/
Envíos de dinero de Perú a Colombia se duplican impulsados por canales digitales,Tu Dinero,"La ruta Perú-Colombia ha mostrado un crecimiento sostenido, principalmente impulsado por quienes apoyan a sus familias.","Las transferencias de dinero desde Perú hacia Colombia alcanzaron los US$25 millones durante 2024, según cifras de la fintech Global66. El número de operaciones superó las 25,000 transacciones en el año, lo que representa un crecimiento del 108% en volumen de envíos con respecto a 2023.Este incremento responde a la demanda creciente de plataformas digitales por parte de usuarios con vínculos familiares o comerciales en Colombia. En 2023 se realizaron 12,430 envíos en esta ruta; en 2024, la cifra se duplicó, consolidando a Colombia como uno de los principales destinos de dinero remitido desde el Perú para la fintech.“La ruta Perú-Colombia ha mostrado un crecimiento sostenido, principalmente impulsado por quienes apoyan a sus familias, costean estudios o mantienen compromisos económicos en Colombia. Esta demanda creciente nos obliga a ofrecer soluciones simples, rápidas y sin costos ocultos”, señaló María José Artacho del Solar, Country Manager de Global66 en Perú.De acuerdo a Artacho, las cifras reflejan una transformación más amplia en América Latina, donde las fintech están ganando participación en el mercado de remesas, tradicionalmente dominado por operadores físicos. “La digitalización, los menores costos y la trazabilidad inmediata están cambiando los hábitos de envío entre países de la región”, explica.Ante ello, la especialista, comenta las formas que actualmente existen en el mercado peruano para el envío de dinero al país colombiano:1. Remesadoras online y fintech: Las plataformas digitales han ganado terreno por ofrecer procesos 100% digitales, sin papeleos ni trámites presenciales. En el caso de Global66, señaló que los usuarios en Perú pueden enviar soles directamente a cuentas bancarias en Colombia, sin que el receptor tenga que estar registrado. Gracias a esta actualización, los envíos a dicho país ahora se realizan en cuestión de minutos.2. Transferencias bancarias internacionales: Los bancos tradicionales permiten enviar dinero a cuentas en Colombia. Aquí resulta importante conocer las comisiones, tipos de cambio y tiempos de entrega.3. Empresas de remesas: En el mercado aún se pueden encontrar empresas que ofrecen el servicio de envíos de dinero. Sin embargo, requiere la presencia del usuario, traslado de dinero en efectivo; poniendo en riesgo la seguridad del cliente.4. Envío físico a través de viajeros: Esta modalidad, aunque en desuso, aún es empleada por personas que recurren a terceros para hacer llegar dinero en efectivo. Presenta riesgos de seguridad, falta de trazabilidad y es poco recomendable.",2025-05-29T21:00:00-05:00,https://gestion.pe/tu-dinero/envios-de-dinero-de-peru-a-colombia-se-duplican-impulsados-por-canales-digitales-noticia/
Atrapados en reuniones: labores de oficina y productividad en Perú en la visión de ejecutivos,Empresas,"Informe de la tecnológica Zoho Corporation en América Latina y Perú aborda el dilema entre las reuniones excesivas y la productividad en las empresas, así como el grado de madurez digital de los espacios de trabajo. ","No más reuniones excesivas. Así parece ser el pedido de muchos ejecutivos en América Latina y el Perú. Y es que, si bien estas actividades apuntan a mejorar los procesos y definir planes, pueden llegar también a restar productividad si se realizan de manera muy frecuente y, sobre todo, sin herramientas que sistematicen estas sesiones, en un contexto en el cual cada vez más pasos son simplificados e inclusive automatizados con herramientas tecnológicas aplicadas a las actividades laborales, según el informe “La Transformación Digital del Lugar de Trabajo en América Latina” de Zoho Corporation. Conozca los detalles.Joel Flores, director de Cuentas Corporativas para Latam en la multinacional tecnológica Zoho Corporation, informó que el grado de maduración digital de las empresas en Perú se ubica en la tercera posición (nivel 2.a o estandarizado) o a mitad de tabla entre cinco países de habla hispana en dicha región, considerando indicadores de “lugar de trabajo” y de “rendimiento”.“Perú está creciendo muy fuerte en la parte de la digitalización de procesos y en la digitalización de herramientas y, por lo tanto, de tareas en el ‘lugar de trabajo’. No solamente vemos que tiene grandes áreas de oportunidad, sino que las está identificando y atacando”, comentó a Gestión. Sin embargo, en línea con el nivel de digitalización, el indicador de productividad (dentro del ámbito del rendimiento) de los espacios laborales en Perú llega solo a una madurez “moderada”, al igual que en los demás países (excepto Chile). En ese resultado, el informe destaca que la sobrecarga de reuniones y la falta de herramientas de gestión estructurada estarían jugando en contra. Y es que, en América Latina y el Perú, más del 65% de los empleados encuestados considera que las reuniones excesivas reducen su productividad, lo que sugiere la necesidad de revisar la frecuencia y el formato de estos encuentros. La falta de estructura en las reuniones puede llevar a una pérdida de tiempo significativa, lo que afecta la capacidad de los colaboradores para concentrarse en sus tareas principales. “En Latinoamérica culturalmente nos gustan las reuniones. Pasamos una buena cantidad del día en ellas y las extendemos, hablamos, comentamos. Es un tema cultural. Frente a ello, el aspecto a abordar es la optimización de tiempos, costos y ganancias”, reconoció Flores. Ante esa situación, recordó que las herramientas digitales permiten ahora no solo desarrollar reuniones remotas, sino también establecer tiempos límite, generar transcripciones, resúmenes e inclusive sugerencias para mejorar la productividad. Si bien la mayoría de los empleados cuestiona el exceso de reuniones, tampoco emplea tecnologías para hacer más eficientes estas actividades. Y es que, según el informe de Zoho Corporation, menos del 20% de los trabajadores en América Latina y el Perú utiliza herramientas que les ayuden a estructurar sus labores, como tableros de control de proyectos para dar seguimiento a sus tareas. Así, se observa una dependencia de métodos tradicionales que terminan dificultando la gestión eficiente de sus labores, aumentando la posibilidad de errores y disminuyendo la visibilidad del progreso en los proyectos. “Hoy en día las herramientas ya las tenemos y ya ni siquiera son de alto costo. Hay herramientas de bajo costo, pero es un asunto cultural al menos en América Latina”, declaró Flores. En el entorno laboral de América Latina, la gestión del tiempo y las herramientas digitales empresariales juegan un papel clave en la productividad de los empleados. Sin embargo, muchas organizaciones de la región aún enfrentan desafíos en la implementación de estrategias eficaces para optimizar la eficiencia en el trabajo. En términos generales, una gran cantidad de las empresas latinoamericanas prefiere seguir realizando sus procesos de forma manual y sin el apoyo de herramientas digitales. Así, no solo terminan comprometiendo su productividad, sino que también generan una fuente potencial de errores humanos. De esa manera, dentro del indicador de procesos y herramientas en el “lugar de trabajo”, Argentina aparece como el país más relegado, pues el 48% de los encuestados manifestó que gestionan sus tareas internas de forma manual, seguido de Colombia (46%), Perú (44%) y México (43%). La realización de tareas manuales contrasta con la baja cifra de compañías que están apostando por la automatización de procesos y por la utilización de herramientas digitales para gestionar sus tareas. En ese ámbito, Perú es el tercer país que más usa (26%) ese tipo de herramientas, superado por Chile (30%) y México (28%). Y en la adopción de la automatización, las firmas de nuestro país también aparecen a mitad de tabla, con 13%. “Hay procesos que evidentemente se pueden automatizar, y hay otros procesos que dentro de la misma automatización requieren pues algunos pasos manuales, pero también hay procesos que tendrían que seguir manteniendo cierta interacción o decisión humana. En ese caso, hablamos de la madurez del conocimiento de los procesos. Una vez que la tengamos, podemos decidir qué vamos a digitalizar y hasta dónde los vamos a digitalizar o automatizar”, anotó Flores. Así, mencionó que hay una correlación entre la delegación manual y la automatización. Mientras la primera es menor, la segunda tiende a crecer. En el referido estudio de la tecnológica india Zoho Corporation, México y Chile muestran el mayor grado de maduración digital de los espacios de trabajo con puntajes de 61.3 y 60.7, respectivamente. En ese sentido, presentan un nivel “estructurado” de digitalización. Para Flores, esos resultados reflejan una mayor madurez en la definición de procesos operativos, no solamente a nivel de documentación, sino también en actualización. Y es que, una vez transitadas esas etapas, se puede identificar qué parte del proceso se puede automatizar. “Hay empresas que identifican muy bien esos procesos y se van hacia la parte de digitalización; o hay otro tipo de empresas que identifican las nuevas tecnologías e innovaciones, y de esas, ven qué tanto podrían ellos invertir para adoptarlas dentro de sus procesos y volverse más competitivas”, explicó. Perú, en el tercer lugar de los países de habla hispana en América Latina con mayor madurez digital, destacó en el pilar de colaboración (empleo de aplicaciones que permiten tener una comunicación más eficiente, una mejor gestión de tareas y una mayor trazabilidad de las solicitudes), al igual que casi todos los demás países, menos Argentina. “Eso no solo nos dice que hay grupos en las empresas del Perú que van identificando sus propios procesos y que van adoptando herramientas para satisfacer las necesidades de cada equipo interno, sino que también han identificado que hay necesidades globales, como el mejor empleo de correo electrónico, que sigue siendo la herramienta número uno de las empresas”, añadió. Sectores. Firmas de tecnología en América Latina tienen un mayor nivel de madurez digital frente a otros sectores. Seguridad. En empresas peruanas, el cumplimiento de protección de datos alcanza al 33%. IA. El 18% de empresas de América Latina usa inteligencia artificial para crear contenido. Muestra: cerca de 500 empleados profesionales en América Latina. Tamaños de empresas: desde pequeñas hasta grandes y corporativas. Técnica: entrevistas virtuales. Trabajo de campo/publicación: 2024/2025. Responsable: área de investigación de mercados de Zoho Corporation. ",2025-05-29T19:53:08-05:00,https://gestion.pe/economia/empresas/mas-reuniones-menos-resultados-el-dilema-en-la-oficina-y-la-mirada-de-ejecutivos-en-peru-noticia/
Pulso bursátil: reporte de mercado de capitales al 30 de mayo,Economía,"VIDEO de Pulso Bursátil. Gestión y la Universidad de Lima presentan el Reporte del Mercado de Capitales al 30 de mayo del 2025, un repaso de los movimientos bursátiles más importantes de la semana.",,2025-05-30T20:41:09-05:00,https://gestion.pe/videos/economia/pulso-bursatil-reporte-de-mercado-de-capitales-al-30-de-mayo-noticia/
Universidad Agraria desarrolla suplemento nutricional y alimentos funcionales: Los proyectos,Perú,UNALM impulsa 23 nuevos proyectos de investigación con financiamiento nacional e internacional.,"Grupos de investigación conformados por estudiantes y docentes de la Universidad Nacional Agraria La Molina (UNALM) trabajan en el desarrollo de propuestas para combatir la anemia y conservar la biodiversidad. Edwin Mellisho, director de Gestión de Investigación del Vicerrectorado de Investigación de la UNALM, precisó que los proyectos abordan temas estratégicos como la sostenibilidad, la seguridad alimentaria, la conservación de la biodiversidad y el uso de tecnologías innovadoras, en concordancia con los Objetivos de Desarrollo Sostenible (ODS).En el ámbito de la agricultura sostenible y la seguridad alimentaria (ODS 2 y 12), destacan iniciativas como Ecosmart Rice, que aplica herramientas de agricultura de precisión y sensores remotos para optimizar la producción sostenible de arroz en Lambayeque; y el desarrollo de una biorrefinería de quinua, orientada a generar productos de alto valor añadido y fomentar la sostenibilidad del cultivo.Respecto a la nutrición y la salud (ODS 3), se desarrolla un suplemento nutricional a base de levadura rica en hierro, una alternativa innovadora, accesible y libre de derivados animales para combatir la anemia; así como alimentos funcionales elaborados con granos andinos fermentados con Monascus sp., que presentan propiedades hipocolesterolémicas, antioxidantes y colorantes naturales.En la línea de biodiversidad y cambio climático (ODS 13 y 15), se ejecutan proyectos como el estudio genético y conservación de Vanilla pompona, especie nativa en riesgo de extinción en la Amazonía; LLAPANGEN, que busca construir el pangenoma de llamas para conservar su diversidad genética; y CUSHUROmics, que aplica herramientas genómicas avanzadas para explorar el potencial nutricional y biotecnológico del cushuro, un alimento ancestral peruano.En 2024, un total de 23 nuevos proyectos han obtenido financiamiento externo, mediante concursos públicos, por parte de instituciones nacionales e internacionales, lo que evidencia la confianza y el respaldo que recibe la comunidad académica molinera.Estos proyectos se suman a otras iniciativas ya en marcha, alcanzando un total de 53 investigaciones activas en la universidad. Entre las entidades financiadoras destacan la Unión Europea, la European Health and Digital Executive Agency, Fontagro, Prociencia y ProInnóvate, que en conjunto han destinado fondos que van desde S/165 mil hasta tres millones de soles, dependiendo del alcance y complejidad de cada propuesta.",2025-05-29T21:00:00-05:00,https://gestion.pe/peru/universidad-nacional-agraria-la-molina-desarrolla-suplemento-nutricional-para-combatir-la-anemia-y-alimentos-funcionales-los-proyectos-noticia/
