title,category,summit,description,date,url
"Sin visa a China: razones, expectativas en Perú y lo que pasará vencido el plazo",Reportaje,"PANORAMA. Los pedidos de visa estaban creciendo 25% este año. Con la excepción, desde China solo esperan mayores visitas peruanas a su país. ¿Qué vendrá después que venza el plazo de liberación del visado? Acá te lo contamos. ","La influencia de China en el Perú ha crecido en varios frentes en las últimas décadas, sobre todo a nivel comercial. Y el reciente anuncio de que los peruanos ya no necesitarán una visa para visitar el gigante asiático, desde el 1 de junio del 2025, refuerza un vínculo que ya era fuerte. Pero este sería solo un hito más en el plan de integración económica que buscan ambos países. Así lo señalan diplomáticos de la Embajada China en Perú.Como se sabe, Perú forma parte de la llamada Iniciativa de la Franja y la Ruta, estrategia de desarrollo económico global que el presidente chino Xi Jinping planteó en 2013 para fomentar la cooperación con su país. El anuncio de no exigir más una visa para los turistas peruanos y otros cuatro países de América Latina es solo una pequeña muestra de un plan más grande que China contempla a futuro con la región. Con el objetivo de “facilitar aún más el intercambio amistoso del personal entre China y América Latina y el Caribe”, la Embajada de China en Perú comunicó que desde el 1 de junio se exonerará a los peruanos de visado para ingresar a su país.Esta medida aplicará para ciudadanos de Brasil, Argentina, Chile y Uruguay y será para estadías de máximo 30 días por, prácticamente, cualquier motivo: negocios, turismo, visita familiar, intercambio y tránsito.La “sorpresa” y novedad del anuncio hizo que se pasara por alto un detalle: esta exoneración será temporal, ya que vencerá el 31 de mayo del 2026. ¿Qué pasará una vez se alcance esa fecha?Según tres diplomáticos de la Embajada China en Perú que conversaron con Gestión, de ninguna manera se daría una exoneración de visado permanente, pero podría extenderse la licencia.“Durante el periodo de prueba, China hará una evaluación integral de sus efectos e informará sobre novedades cuando corresponda. El gobierno chino podría dar una prórroga, de uno o más años, pero depende de cada país”, explicaron.Este ha sido el mismo camino que han recorrido hasta otros 38 países que, antes de los cinco de América Latina, recibieron esta ventaja de ingreso desde diciembre del 2023.En otras palabras, se trata de una política “piloto” de excepción de visas que China inició hace dos años con el objetivo de fomentar la “conexión entre los pueblos”, dicen desde la Embajada. Desde entonces, se ha renovado la vigencia de esta medida para el primer grupo que recibió la gracia. Estos fueron cuatro países europeos (Francia, Alemania, Italia, Países Bajos y España) y Malasia con estadías de máximo 15 días, medida que venció en noviembre del 2024, pero fue renovada hasta finales de este año, ya con estancias de un mes, igual a la que se anunció para Perú.Los diplomáticos de la Embajada China en Perú resaltaron que, incluso antes del anuncio de esta medida, las solicitudes regulares de visa en su local, ubicado en San Isidro, venían al alza, luego de un 2024 donde la relación China-Perú se fortaleció, tras la apertura del puerto de Chancay.“Según nuestras estadísticas, entre enero y abril, el número de visas emitidas a ciudadanos peruanos aumentó 25% este año en comparación al mismo periodo del 2024″, precisaron.Para los diplomáticos, esta es una prueba del “fervor” de los peruanos por visitar China, por lo que, al igual que varios analistas, esperan una aceleración de la demanda de viajes por negocios. “Llegar a China desde Perú es caro. Pero sabemos que hay aerolíneas chinas que están analizando la factibilidad de abrir nuevas rutas de vuelo”, agregaron. Según más datos de la Embajada China en Perú, la relación económica comercial bilateral entre ambos países está más fuerte hoy que nunca antes.Ya van 11 años consecutivos donde China se mantiene como el mayor socio comercial de Perú. En 2024, el comercio bilateral entre ambos países alcanzó los US$ 41 mil millones. Pero el año pasado fue clave por otros dos hechos: se inauguró el puerto de Chancay, proyecto que forma parte de la Iniciativa de la Franja y la Ruta; y se firmó la optimización del Tratado de Libre Comercio (TLC) entre ambos países. Ambos hitos se dieron en el marco de la visita oficial del presidente Xi Jinping a Perú, durante el Foro de Cooperación Económica Asia-Pacífico (APEC). Y que, junto con la anunciada liberación de la visa, forman parte de una misma estrategia. “La relación es que cada hecho es un incentivo para el otro. Chancay es un proyecto emblemático de la Iniciativa; la exoneración de visa y optimización del TLC son instrumentos para facilitar el los flujos de personal, comercial y de inversión, mostrando nuestra firme actitud de apoyar el multilateralismo y el libre comercio“, remarcaron desde la Embajada de China en Perú. Los diplomáticos de la Embajada que dialogaron con Gestión recordaron que el anuncio de la liberación de visado para Perú se dio en el marco de la IV Reunión Ministerial del Foro China-CELAC (FCC), realizada en Beijing. Allí fue que el presidente Xi Jinping dio el tan comentado anuncio, pero no es lo único a lo que China se comprometió en dicha cumbre. En esa reunión, el presidente del gigante asiático planteó la construcción conjunta de lo que llamó “cinco programas o cinco grandes obras” con América Latina.Estos llevan nombres genéricos, pero cada uno tiene medidas concretas. Son los programas de la solidaridad, desarrollo, de las civilizaciones, de la paz y de los pueblos. En este último se encuentra contemplada precisamente la exención de visado.“Como país esperamos ahora que Perú pueda proporcionar un apoyo de políticas proactivo para agilizar los trámites de ingreso [a su país] para los ciudadanos chinos, consolidando así un círculo virtuoso de movilidad bilateral”, refirieron desde la Embajada.En el FCC se aprobó también el Plan de Acción Conjunto CELAC-China para la Cooperación en Áreas Clave (2025-2027). Esta guía contiene medidas diversas en varios frentes. Una de las más resaltantes es la disposición de profundizar la cooperación en proyectos de infraestructura de varios tipos. El plan hace énfasis en las obras ferroviarias.Precisamente, la semana pasada, estuvo de visita en Perú Fei Dongbin, máxima autoridad de la entidad gubernamental china a cargo del desarrollo ferroviario de trenes en este país, como contó Gestión. Su misión fue dialogar sobre proyectos como el llamado Tren Biocéanico.",2025-05-31T18:09:39-05:00,https://gestion.pe/g-de-gestion/reportaje/china-no-pedira-visa-al-peru-desde-junio-razones-expectativas-y-lo-que-pasara-vencido-el-plazo-noticia/
"Dólar acentúa caída en mayo, ¿romperá piso de S/ 3.60 en junio?",Tu Dinero,"La rebaja de calificación crediticia de EE.UU. de parte de la clasificadora Moody’s, terminó poniendo en duda la capacidad de pago del país.","El dólar acentúa la caída registrada frente al sol en el año y cierra mayo con una reducción mensual de 1.1% en su cotización.Con ello, la divisa estadounidense encadena el quinto mes con tendencia a la baja y acumula una depreciación de 3.64% en lo que va del 2025, según datos del Banco Central de Reserva del Perú (BCRP).Como en los meses previos, mayo también fue un periodo volátil para el tipo de cambio, que si bien inició en S/ 3.66, llegó a ubicarse en S/ 3.69 a mediados de mes, para luego retroceder hasta S/ 3.624 ayer, comentó Javier Gamboa, gerente de inversiones de Rimac.La salida de Gustavo Adrianzén del cargo de primer ministro en el Gobierno de Dina Boluarte, en el plano local, y los cuestionamientos a EE.UU. sobre el déficit fiscal, en el foco internacional, provocaron un temporal fortalecimiento del billete verde, indicó. La incertidumbre sobre lo que podría pasar en EE.UU. gatilló que las tasas de los bonos del Tesoro suban y, con ello, las tasas en dólares, agregó.Sin embargo, la rebaja de calificación crediticia de EE.UU. de parte de la clasificadora Moody’s, terminó poniendo en duda la capacidad de pago del país, debido a las elevadas tasas de interés y niveles de deuda, y provocó que el dólar se debilite, comentó Gamboa.“La sensación del inversionista es que ya no hay tanta estabilidad en EE.UU., por tanto, cree que debe salir de su exposición en dólares y parquearse en otras monedas como la de Europa, Japón o países emergentes”, manifestó.Otros analistas bancarios puntualizan el enfriamiento de la guerra comercial durante el último mes como un factor importante en el desempeño del dólar, pues los países negociaron las tarifas establecidas en abril por EE.UU. y llegaron a acuerdos bilaterales.“Además, los inversionistas observaron una economía estadounidense sobreendeudada, con un déficit muy alto y un presidente –Donald Trump– poniendo más leña al fuego con una propuesta fiscal de reducción de impuestos sin recortes de gasto”, sostuvo un especialista del mercado cambiario. EE.UU. tenía la nota más elevada en nivel de riesgo crediticio, la reducción no fue nada beneficiosa para la economía y derivó en un dólar aún más débil, acotó.La mayor oferta de dólares en el mercado en el último mes provino de los inversionistas offshore o no residentes en Perú, entre ellos, bancos del exterior sin domicilio local y hedge funds. Este grupo optó por revender dólares, pese a haberlos comprado en niveles de S/ 3.70, pues empiezan a ver la moneda peruana como un activo fuerte y estable, refieren analistas. De acuerdo con los especialistas, el billete verde seguiría la senda bajista en junio. Así, estiman que la moneda extranjera se movería entre S/ 3.60 y S/ 3.70, sobre todo, en la parte baja del rango.Otros analistas proyectan que sí podría bajar incluso a S/ 3.58, si se acentúan los riesgos internacionales, especialmente, el relacionado con la deuda estadounidense.El próximo mes habrá un flujo grande de pago de dividendos que implica la compra de dólares, lo que generaría un soporte al tipo de cambio en los niveles actuales, prevé Gamboa. “No obstante, será necesario monitorear el mercado internacional, las tarifas impuestas por EE.UU. así como el déficit fiscal, pues de acentuarse los problemas podrían debilitar más al dólar”, declaró. El Índice General de la Bolsa de Valores de Lima (BVL) registró un incremento de 4.2% en mayo, con lo que acumula una ganancia de 11.7% en lo que va del 2025.Las compañías peruanas listadas en la bolsa en conjunto han registrado mayores utilidades por cuatro trimestres consecutivos, en línea con la recuperación de los indicadores de actividad económica y por mayores eficiencias operativas, dijo Luis Ramos, de LarrainVial. “En adelante, el mercado estará atento a decisiones de política arancelaria de EE.UU. clave para recalibrar el apetito por riesgo”, agregó.",2025-05-30T19:10:39-05:00,https://gestion.pe/tu-dinero/dolar-acentua-caida-en-mayo-rompera-piso-de-s-360-en-junio-noticia/
Marcas peruanas revelan cuatro claves para crecer online y offline,Empresas,"Escuchar a los clientes, diversificar canales de venta, construir una propuesta auténtica y operar con visión estratégica son las lecciones compartidas por emprendedores peruanos.","Emprender en el Perú es una ruta desafiante, pero cada vez más emprendedores logran destacar gracias a una combinación de intuición, estrategia y perseverancia. Cuatro marcas locales que han consolidado su presencia en el mercado, tanto online como offline, revelan las prácticas que han sido clave para su crecimiento sostenible.1. Escucha activa: conoce a fondo a tu comunidadMauricio y Julio Bilbao, fundadores de Tauri Superfoods, aprendieron que la clave está en escuchar. “La interacción cercana, las encuestas, la atención personalizada y el contenido constante nos permitieron entender lo que realmente necesitaban nuestros clientes”, explican. Gracias a esa cercanía, han podido adaptar sus productos de nutrición vegana a las necesidades reales de su comunidad y construir relaciones sólidas.2. Persevera y diversifica tus canales de ventaAl frente de Nibray, marca especializada en alimentación complementaria, Bryan Flores recuerda que los inicios fueron duros. “Las ventas eran muy bajas al comienzo”, confiesa. Su respuesta fue explorar nuevos canales como los marketplaces y las redes sociales, lo que impulsó el crecimiento de la marca. Hoy, recomienda, además, delegar y confiar en el equipo: “Nadie emprende solo”.3. Conecta desde la autenticidad y las historias realesPara Melina Salazar, fundadora de Metamorfosis, marca de moda circular, lo que genera una conexión profunda con el público no es solo el producto, sino la historia detrás de cada prenda. “Cada pieza tiene una transformación, una historia que la clienta valora. La transparencia es nuestro diferencial”, explica. Su apuesta por un consumo consciente ha generado impacto real.4. Organízate como si fueras grande, aunque estés empezandoLuis Mariño, cofundador de Tu Mesita, emprendimiento dedicado a la fabricación de muebles a medida en melamina, afirma que la estrategia es esencial desde el día uno. “Así estés vendiendo desde casa, necesitas una estrategia, objetivos claros y reuniones semanales. Eso hace la diferencia”. También destaca el rol del clima laboral como base para un equipo motivado y productivo.Estos casos muestran que el éxito emprendedor va más allá de las ventas: se trata de generar valor, impacto y relaciones sostenibles. Existen iniciativas que acompañan este tipo de crecimiento, ofreciendo a las MIPYMES peruanas oportunidades de capacitación, mentoría y expansión comercial. Una de ellas es Perú Pasión, impulsada por Intercorp Retail.",2025-05-30T18:23:23-05:00,https://gestion.pe/economia/empresas/marcas-peruanas-revelan-cuatro-claves-para-crecer-online-y-offline-noticia/
De sobrevivir a los nazis a inventar la píldora abortiva: Étienne-Émile Baulieu fallece a los 98 años,Internacional,"“Luchador de la resistencia, genio de la investigación, defensor de la contracepción, inventor de una píldora abortiva, Étienne-Émile Baulieu fue un espíritu de progreso que permitió a las mujeres conquistar su libertad”, reaccionó el presidente francés, Emmanuel Macron.","El científico francés Étienne-Émile Baulieu, que revolucionó la vida de millones de mujeres tras inventar la píldora abortiva, falleció este viernes a los 98 años, tras una larga carrera en la que siempre buscó crear herramientas “útiles para el bienestar humano”.Baulieu, médico e investigador, murió en su domicilio parisino, anunció su esposa, Simone Harari Baulieu, en un comunicado transmitido a AFP.“Sus investigaciones estaban guiadas por su apego a los avances permitidos por la ciencia, su compromiso a favor de la libertad de las mujeres, su voluntad de permitir a todos vivir mejor por más tiempo”, declaró.“Luchador de la resistencia, genio de la investigación, defensor de la contracepción, inventor de una píldora abortiva, Étienne-Émile Baulieu fue un espíritu de progreso que permitió a las mujeres conquistar su libertad”, reaccionó el presidente francés, Emmanuel Macron, en X. Doctor en Medicina (1955) y en Ciencias (1963), Baulieu se hizo mundialmente famoso por la trascendencia científica, médica y social de sus trabajos sobre las hormonas esteroides.Además de inventar la píldora abortiva en 1982, durante su carrera buscó maneras de retrasar el envejecimiento, luchar contra la depresión y el Alzheimer. Sus temas predilectos, había dicho en una entrevista a AFP, eran “las mujeres, la salud cerebral y la longevidad”.“Siempre he intentado combinar ciencia y progreso, aplicaciones útiles para el bienestar humano”, afirmaba. Sus descubrimientos, sin embargo, no siempre fueron aclamados de manera unánime. Tras inventar la píldora abortiva, fue arrastrado ante los tribunales y demonizado por las poderosas ligas antiabortistas estadounidenses, que le acusaron de crear una “píldora de la muerte”.Nacido el 12 de diciembre de 1926 en Estrasburgo, en el este de Francia, Etienne Blum tomó el nombre de Émile Baulieu cuando se unió a la Resistencia contra la ocupación nazi, con tan solo 15 años.Tras la guerra, es invitado a trabajar en Estados Unidos. En 1961 se gana el apoyo de Gregory Pincus, padre de la píldora contraceptiva, que lo convence para que investigue sobre las hormonas sexuales.Al volver a Francia concibe una antihormona que logra bloquear la acción de la progesterona, esencial para la implementación del óvulo en el útero.La molécula RU-846, desarrollada con la ayuda del laboratorio Roussel-Uclaf, se convierte en una alternativa médica al aborto quirúrgico, seguro y menos traumático.Pero la batalla por su comercialización apenas empieza. El francés se enfrenta a virulentas críticas y recibe incluso amenazas. También trata incansablemente de convencer a los gobiernos a autorizar la distribución de la RU-486.Hace dos años, tras la prohibición de la píldora abortiva en el estado de Wyoming, en Estados Unidos, Baulieu dijo AFP que esto suponía un “retroceso para la libertad de las mujeres”. El científico fue distinguido con el premio Lasker en 1989 por el descubrimiento de la píldora abortiva. El galardón es la mayor distinción científica estadounidense y es considerado un potencial precursor del Nobel para quienes lo obtienen.Baulieu también obtuvo la Gran Cruz de la Legión de Honor y de la Orden Nacional del Mérito, dos importantes distinciones en Francia.El endocrinólogo también realizó investigaciones sobre la DHEA, una hormona cuya secreción y actividad contra el envejecimiento había descubierto. Estos estudios le llevaron después a trabajar sobre los neuroesteroides (esteroides del sistema nervioso).Baulieu desarrolló un tratamiento para combatir la depresión, cuyo ensayo clínico está actualmente en curso en varios hospitales universitarios.En 2008 fundó el Instituto Baulieu para comprender, prevenir y tratar enfermedades neurodegenerativas como el Alzheimer. Su investigación se centró en las proteínas Tau y FKBP52. “No hay razón para que no encontremos tratamientos” contra esta enfermedad, dijo en su momento a AFP.En su oficina situada a las afueras de París, amontonaba fotos, diplomas y carpetas con “el trabajo de toda una vida”. Hasta el final, expresó su deseo de “ser útil”.Amigo íntimo de Andy Warhol, era un apasionado de la literatura y se declaraba “fascinado por los artistas, que afirman tener acceso al alma humana, algo que permanecerá siempre fuera del alcance de los científicos”.",2025-05-30T19:51:47-05:00,https://gestion.pe/mundo/internacional/de-sobrevivir-a-los-nazis-a-inventar-la-pildora-abortiva-cientifico-frances-etienne-emile-baulieu-fallece-a-los-98-anos-noticia/
"Nuevos afiliados a la AFP serán incorporados a Profuturo, ¿desde cuándo?",Perú,Esta designación permitirá a los nuevos afiliados acceder a la comisión por saldo más baja del mercado: 0.68% anual.,"La administradora de fondos de pensiones Profuturo AFP será la encargada de recibir a todos los nuevos afiliados al Sistema Privado de Pensiones (SPP) a partir del 1 de junio, tras adjudicarse la última licitación convocada por la Superintendencia de Banca, Seguros y AFP (SBS).Como parte de esta adjudicación, Profuturo reducirá su comisión por saldo a 0.68% anual, la más baja del mercado. Esta reducción no solo beneficiará a quienes ingresen al sistema desde junio, sino también a los más de 1.2 millones de afiliados actuales bajo el esquema de comisión por saldo, quienes verán aplicado automáticamente el nuevo porcentaje.Desde la implementación del mecanismo de licitación de nuevos afiliados en 2013, el SPP ha conseguido reducir significativamente los costos para los afiliados, promoviendo mayor competencia y eficiencia en la gestión de fondos previsionales.“Esta decisión marca un paso importante hacia un sistema previsional más competitivo, sostenible y seguro”, sostuvo Carlo Castoldi, gerente general interino de Profuturo AFP.La medida también refuerza el atractivo de la AFP como una opción sólida para quienes se incorporan al mercado laboral formal y buscan una opción confiable, eficiente y accesible para construir su futuro.",2025-05-30T20:24:50-05:00,https://gestion.pe/peru/afp-desde-el-1-de-junio-nuevos-afiliados-al-sistema-seran-incorporados-a-profuturo-noticia/
ONU: toda la Franja de Gaza al borde de la hambruna por ataques de Israel ,Internacional,"“El lugar con más hambre del mundo”, indican desde la ONU. Israel aseguró que intensificará su ofensiva.","La Organización de Naciones Unidas - ONU alertó que toda la población de la Franja de Gaza está al borde de la hambruna. Hace poco advirtieron desde la FAO que menos del 5% de la tierra palestina es cultivable tras los ataques de Israel.Los datos de la ONU se dan en plena reanudación —tras una tregua de dos meses— de la ofensiva israelí en territorio palestino, como parte de la guerra con Hamás. La ONU precisa que la situación humanitaria “sigue siendo muy grave” pese a que se haya levantado el bloqueo total que impuso el régimen de Benjamín Netanyahu a la ayuda internacional. Sin embargo, el suministro permitido es insuficiente, alegan las oenegés.“El lugar con más hambre del mundo”, dijo en referencia a Gaza el portavoz de la Oficina de Coordinación de Asuntos Humanitarios de la ONU (OCHA), Jens Laerke.“Es la única zona delimitada, un país o un territorio definido dentro de un país, donde la totalidad de la población tiene riesgo de hambruna. El 100% de la población está en riesgo de hambruna”, apuntó.Israel propicia la expansión de sus asentamientos en Cisjordania (territorio palestino): esta semana anunció la creación de 22 colonias. Reino Unido cree que es un “obstáculo deliberado” a la creación de un Estado palestino; mientras que Antonio Guterres, portavoz del jefe de la ONU, considera que es “una dirección equivocada” en la lucha por poner fin al conflicto.El presidente de Francia, Emmanuel Macron, ve necesario que se reconozca a Palestina como un estado no solo por “deber moral, sino como exigencia política”. “Esta es una respuesta decisiva a las organizaciones terroristas que tratan de dañar y debilitar nuestro control sobre esta tierra”, contrargumentó ministro de Defensa israelí, Israel Katz.El régimen de Netanyahu ha causado la muerte, en las últimas horas, de 45 personas tras bombardeos en Jabaliya, en el norte de Gaza. Itamar Ben Gvir, ministro de Seguridad Nacional de Israel, reconoció que “es hora de entrar con toda la fuerza necesaria, sin pestañear, para destruir (...) a Hamás”.Con información de AFP.",2025-05-30T20:28:11-05:00,https://gestion.pe/mundo/internacional/onu-toda-la-franja-de-gaza-al-borde-de-la-hambruna-por-ataques-de-israel-noticia/
