title,category,summit,description,date,url
¿Una denuncia ante Sunafil protege al trabajador del despido? La Corte aclara,Economía,El caso llegó a la Corte tras un cese ocurrido días después de una inspección laboral solicitada por el propio trabajador.,"Cuando un trabajador presenta una queja o denuncia ante la Superintendencia Nacional de Fiscalización Laboral (Sunafil), la legislación laboral establece ciertas garantías para evitar represalias por parte del empleador. Entre ellas, se encuentra la prohibición de despido motivado por dicha acción. Sin embargo, la presentación per se de una queja no siempre basta para anular un despido, por lo que le corresponde a los tribunales determinar cuándo se configura efectivamente un acto de represalia que vulnere derechos fundamentales.En una reciente sentencia, la Corte Suprema analizó el alcance del artículo que regula esta forma específica de despido nulo. El pronunciamiento abordó los elementos necesarios para que esto configure y la carga probatoria que recae sobre el trabajador al momento de alegar represalias.El proceso fue iniciado por un extrabajador que solicitó la desnaturalización de su contrato modal y su reposición en el puesto de trabajo, argumentando que su despido se debió a una represalia por haber solicitado una inspección a Sunafil contra su empleadora. Según el expediente, la solicitud fue presentada el 27 de marzo de 2015 y la visita inspectiva se realizó el 27 de abril. Tres días después, el 30 de abril, el vínculo laboral concluyó. El juzgado de primera instancia declaró fundada la desnaturalización del contrato pero desestimó los pedidos de despido nulo y despido fraudulento, decisión que fue confirmada por la sala superior.Al evaluar el recurso de casación, la Corte Suprema analizó si el despido calificaba como nulo según una disposición (del Decreto Supremo N.º 003-97-TR) que prohíbe cesar a un trabajador por haber presentado una queja o iniciado un proceso contra su empleador. Sin embargo, la Sala precisó que no basta con acreditar la existencia de una queja previa, sino que también debe demostrarse que el empleador incurrió en conductas destinadas a impedir arbitrariamente los reclamos. Esta interpretación se basa en una normativa que exige el cumplimiento de ambos elementos para configurar la nulidad del despido.Con base en los documentos y alegaciones presentadas, el tribunal concluyó que no existían indicios suficientes para demostrar que la empresa actuó con ánimo de represalia.Tanto César Puntriano, socio del Estudio Muñiz, como Brian Ávalos, socio del Área Laboral de Payet, Rey, Cauvi, Pérez, Abogados, coincidieron en que no basta con que el trabajador haya presentado una queja o denuncia ante una autoridad como la Sunafil para que se configure un despido nulo por represalia.“El trabajador tiene que probar el nexo causal entre el despido y la queja. No se trata solo de demostrar que hubo una denuncia, sino que el empleador actuó con la intención de impedir los reclamos”, explicó Puntriano. Ávalos complementó: “El despido nulo implica una protección especial, pero eso exige una mayor carga probatoria. Se debe acreditar que la queja tuvo relación directa con el cese”.Ambos abogados destacaron que este tipo de casos requiere que el trabajador aporte indicios o elementos que revelen un ánimo del empleador de represalia.Ávalos precisó que no se necesita una confesión directa, pero sí pruebas indirectas: “Por ejemplo, correos, testimonios, comparaciones con otros trabajadores cuyos contratos sí fueron renovados o informes de desempeño. Todo eso puede evidenciar que la no renovación fue una excusa”. Puntriano, por su parte, señaló que también pueden ser relevantes antecedentes similares dentro de la misma empresa: “Si hubo otros trabajadores que fueron cesados después de reclamar, podría evidenciarse una conducta sistemática”.La protección frente al despido por represalia no se activa con cualquier tipo de comunicación, sino solo cuando se trata de quejas formales vinculadas a derechos laborales, presentadas ante autoridades competentes.Puntriano señaló que la jurisprudencia ya ha precisado que no toda queja o comunicación interna activa esta protección especial. “Tiene que tratarse de una denuncia presentada ante la Sunafil, el Poder Judicial u otra autoridad, y que esté relacionada con el ejercicio de derechos laborales. No basta con un reclamo verbal al jefe inmediato o un comentario general”.Esto implica que la forma, el canal y el contenido del reclamo sí importan al momento de analizar si hubo represalia. La protección legal se limita a casos donde el trabajador utilizó los mecanismos adecuados para denunciar un incumplimiento relacionado con su vínculo laboral.A diferencia de otros tipos de despido, como el incausado o el fraudulento, el despido nulo por represalia implica una protección reforzada para el trabajador, ya que afecta el ejercicio de derechos fundamentales, como el derecho de defensa o de queja. Por esa razón, la jurisprudencia ha establecido que esta figura exige un mayor estándar probatorio, es decir, una demostración más sólida y detallada de los hechos alegados.Los abogados consultados coincidieron en que este estándar más alto busca evitar el uso indiscriminado de esta figura como un recurso para bloquear decisiones empresariales legítimas. “No se puede permitir que cualquier trabajador alegue represalia sin sustento suficiente porque eso distorsiona el equilibrio de la relación laboral”, comentó Ávalos. Por eso, en estos casos, el juez requiere pruebas más precisas y coherentes, y no bastan las sospechas o las coincidencias temporales entre una queja y un despido.",2025-05-31T20:05:00-05:00,https://gestion.pe/economia/corte-suprema-define-limites-del-despido-tras-una-denuncia-laboral-sunafil-despido-por-represalia-noticia/
¿Crisis en la educación superior? Qué dice McKinsey sobre Perú y las clases virtuales,Reportaje,"ENTREVISTA. Sebastián Riomalo, socio líder de Educación en McKinsey, revisa el crecimiento de plataformas online como Platzi, Coursera y Udemy, así como el reto que enfrentan las universidades tradicionales, muchas de ellas con márgenes financieros cada vez más ajustados. ¿Qué se avecina en el negocio educativo?","“Los ingresos de las universidades tradicionales no están creciendo al mismo ritmo que sus costos”, sentencia Sebastián Riomalo, socio líder de Educación en McKinsey. La consultora ha analizado el crecimiento acelerado de la educación online en América Latina: quiénes lideran el mercado, cuánto espacio hay aún para expandirse y hacia dónde deberían enfocarse las casas de estudio con mayor trayectoria. ¿Qué se avecina en Perú?¿Cuál es la situación de la educación online en la región?A nivel de América Latina hay dos referentes que han avanzando en la educación online: Brasil y Colombia. En el mercado brasilero, el 70% de los nuevos matriculados eligen la modalidad a distancia versus la presencial. Un factor clave para este avance fue que la regulación se abrió más rápido a estos modelos, permitiendo que las universidades privadas crezcan más rápido en este espacio. ¿Y en Perú?En el caso de Perú creo que es distinto. Aquí la participación de las grandes universidades privadas aún es importante: el 76% de los alumnos de pregrado están matriculados en algunas de ellas. Además, la regulación sobre las clases a distancias recién comenzó a abrirse en el 2020. ¿En cuánto crecerá la educación online?Parte del estudio de Mckinsey revela que, en las grandes economías, la educación online crece a una tasa compuesta al año del 12%, mientras que la educación presencial a 1%. En Perú no es diferente.¿La tasa de crecimiento es más alta en Perú?Te doy una tasa que incluye a Brasil, ahí el número de estudiantes que se inscriben a clases online crece entre 25% y 35% al año, en Perú podría ser más alto porque el mercado recién se ha abierto. La comparación es solo frente a las universidades o también institutosUna de las tendencias que vemos es la entrada de jugadores no oficiales que quieren participar en la educación continua, ofreciendo programas de alta calidad. Por ahora, la fortaleza de las universidades tradicionales es que dan el título oficial que, para ciertos empleadores es fundamental y eso, de algún modo, ha protegido el crecimiento de estas casas de estudio versus los entrantes. Lo que es claro es que el escenario futuro es más retador. ¿Han incluido en el reporte los emprendimientos de personas naturales que crean sus cursos o especializaciones virtuales?No, pero si la incluimos, la data sería mucho más alta. ¿Qué plataformas digitales o centros online están liderando?Hay que recordar que las universidades tienen como fortaleza el mundo del posgrado y pregrado, mientras que las plataformas compiten principalmente en educación continua. La pregunta es: ¿cómo las universidades se van a adaptar?Solo Brasil, por ejemplo, tiene 32 millones de usuarios. Si lo vemos por plataformas, Platzi tiene 5 millones de usuarios y ha totalizado 12 millones de estudiantes. Crehana también ha llegado a los 5 millones de usuarios. Entonces, este modelo ya escaló y parte de lo que deben hacer las universidades es innovar en su producto, ofrecer la misma lógica y flexibilidad que los nuevos jugadores. Otros como Coursera o Udemy han apostado por aliarse con universidades para llegar a más estudiantes. Y otros como OpenEnglish, tienen una propuesta de valor muy definida: van a tener que ajustarse a la flexibilidad que pide el estudiante y competir más por precio. ¿Cuánto durará este auge de la educación virtual?La data oficial es que seguirá creciendo en los próximos cinco años y una razón es que no anticipamos que el tema demográfico (un mayor número de personas de +30 años) vaya a tener un impacto. Tampoco es un mercado saturado, porque está incorporando a personas que en otras condiciones no hubieran estudiado más allá de los 35 años. ¿Qué oportunidades de mejora tienen las universidades?En mercados donde el crecimiento ha estado más acotado, como Argentina o Chile, vemos que las universidades tienen un interés más claro en otras avenidas de crecimiento como la educación continua y online. Si el mercado aún no está saturado, ¿quiere decir que hay más jugadores en el horizonte?Vemos intereses a nivel regional de participar en el mercado peruano de la educación superior. Básicamente porque hay muchos elementos atractivos: el crecimiento que está registrando y la idea de que aún tiene mucho por expandirse, y condiciones regulatorias más flexibles. A nivel financiero, ¿cuál es la situación de las universidades tradicionales?Vemos un menor margen financiero. ¿Cuándo ocurrió? No creo que haya sido de un solo momento, pero las tasas de crecimiento se han ido acotando, sobre todo, en aquellas cuya fortaleza eran las clases presenciales y, a medida que crecía la educación online, registraban crecimientos más lentos. ¿Cuál es la razón?La razón de fondo es que están viviendo un espacio de acoplarse a las nuevas tendencias. Muchas de ellas tienen que generar un músculo de gestión y capacidad de transformación, porque los ingresos no están creciendo al mismo ritmo que sus costos. Por eso, el llamado es que las universidades se transformen incorporando la nueva tecnología. Ante esta situación, ¿veremos más adquisiciones o procesos de consolidación?Hay universidades que no quieren vender pero necesitan cambiar incorporando ese músculo de gestión más efectivo en términos de la estructura de costos. Y hay otras, que no quieren hacer todo el ejercicio de transformación y están siendo adquiridas por jugadores importantes. Lo que anticipo son muchos modelos de consolidación y crecimiento tanto en Perú, México, Brasil y Chile. Entonces, aquellas universidades que solo apalanquen su crecimiento en nuevas sedes, ¿se están quedando atrás en la cola?Aquellas que solo estén centradas en la infraestructura física deben entender qué lugar ocupará su propuesta online en su propuesta de valor, porque en los próximos cinco años la lógica actual del negocio no será la misma. Luego de los cinco años de posible buen crecimiento, ¿qué se esperaría?Anticipar el futuro siempre es difícil. Lo que sabemos con certeza es que se espera que la población siga envejeciendo. En el 2015, la edad promedio en América Latina era de 28 años, ahora está en 31 años. ¿Qué significa eso? Que habrá más personas mayores que probablemente tengan un perfil diferente: querrán seguir formándose, acceder a educación continua, pero será más difícil convencerlas de ingresar a programas tradicionales de pregrado. ¿Hoy el grueso del mercado sigue siendo jóvenes menores de 30 años?Sí. El estudiante típico de pregrado presencial en América Latina está entre los 18 y 23 años. En cambio, los estudiantes de educación a distancia suelen estar más cerca de los 30 años. Demandan mayor flexibilidad y no pueden desplazarse todos los días. A medida que la población envejezca, los formatos híbridos y online seguirán creciendo.¿Qué ha jalado más el crecimiento: el pregrado o la educación técnica?Si separamos entre presencial y modalidades virtuales, la educación técnica ha venido creciendo bastante en América Latina. Por ejemplo, en Chile la educación técnica está bien posicionada, con más de 150 mil estudiantes en instituciones que atienden solo ese segmento. En Perú también hay mayor interés por este tipo de programas, en parte por la promesa de obtener un título técnico en menos tiempo.¿Y en el caso del posgrado?Las maestrías crecen pero a un ritmo más acotado porque es un producto con mucha más competencia internacional, especialmente en el espacio virtual. Hoy hay muchas universidades extranjeras ofreciendo programas de posgrado en línea, lo que hace que esta avenida de crecimiento sea más difícil. El pregrado seguirá siendo el core del negocio educativo.¿Y cómo se están adaptando los empleadores?Las universidades más preocupadas por conectar con los empleadores están comenzando a desarrollar músculo de gestión para adaptar sus currículos. Hay jugadores que buscan generar titulaciones en alianza con las empresas, para que el contenido académico se alinee con lo que el mercado laboral. Parte del objetivo es tener mayor capacidad de reacción ante la demanda del mercado.¿La internacionalización representa una oportunidad o un riesgo?Si, pero también es un espacio muy competitivo. La mayoría de universidades locales aún no están bien posicionadas internacionalmente. Sin embargo, hay casos interesantes. Por ejemplo, algunas universidades en Ecuador están aprovechando este momento para atraer estudiantes de otros países y ofrecer doble titulación. Eso hace que los alumnos vean a América Latina como una región interesante para estudiar.¿Son más las mujeres que se inscriben a la educación virtual?Con la educación a distancia son más las mujeres que pueden acceder a educación. Muchas de ellas tienen el perfil de ser cabeza de hogar, entonces, requieren de un modelo flexible para capacitarse. La adopción de la inteligencia artificial generativa está transformando la experiencia educativa. “Según un estudio de Mckinsey, esta tecnología impulsará importantes innovaciones en productos y servicios educativos, con un impacto económico global estimado entre 120 mil y 230 mil millones de dólares en productividad. Esto podría representar hasta el 3,2% de los ingresos totales de la industria educativa”, señala Sebastián Riomalo, socio líder de Educación de Mckiseny. Se identifican tres usos principales:",2025-05-31T22:04:00-05:00,https://gestion.pe/g-de-gestion/reportaje/mckinsey-revela-que-la-educacion-virtual-crece-12-veces-mas-que-la-presencial-y-en-peru-universidades-noticia/
"El nuevo ‘centro’ de Unacem, tras finalizar despachos a ‘Jorge Chávez’ y puerto de Chancay",Empresas,"Luego de un retador inicio de año, Unacem Perú comenta a Gestión sobre sus planes de crecimiento para el resto del 2025. Más detalles en esta nota. ","Los primeros tres meses del año han sido retadores para la operación de Unacem Perú, considerando que sin proyectos de envergadura —como la construcción del nuevo aeropuerto internacional Jorge Chávez y el terminal portuario de Chancay— los despachos de cemento se han contraído 0.8% en relación a similar periodo del 2024. Bajo ese panorama, ¿en qué proyectos apalanca la cementera su crecimiento?El gerente Comercial de la compañía, Gabriel Barrio, indicó que si bien, en el primer trimestre se observó una ligera reducción en los volumenes de despacho de cemento, la firma ha logrado mantener su participación en el mercado nacional, con una presencia de 45.1%. Así, en adelante, las expectativas de la empresa se enfocan principalmente en las ventas dirigidas a la autoconstrucción. “Lo que estamos viendo con bastante optimismo es que el canal ferretero, que atiende sobre todo a la autoconstrucción, ha aumentado 4.3% en el primer trimestre 2025. Este crecimiento no lo veíamos desde hace más o menos 18 meses y nos hace pensar positivamente para el resto del año”, señaló el ejecutivo. La proyección de la firma para el segundo trimestre es que se mantendrán los números del mismo periodo del año pasado, sustentado en un buen momento para la autoconstrucción, el cual representa entre el 50% y 60% de las ventas de Unacem. En torno a grandes proyectos, Barrio sostuvo que realizan el seguimiento de obras a desarrollarse en los próximos años, como el proyecto Anillo Periférico Vial y la nueva Carretera Central.Actualmente, la firma viene trabajando en la reducción del factor clinker en el cemento, en línea con los objetivos del sector de ser carbono neutral al 2050. “Tenemos que adicionar a nuestros cementos otros materiales cementicios sin afectar la calidad del mismo. En esta primera etapa, la meta al 2030 es lograr reducir 500 kilos de emisiones de CO2 por tonelada de cemento que producimos”, expresó Barrio.Para alcanzar dichos avances en sostenibilidad, el ejecutivo indicó que la empresa cuenta este año con un CAPEX de S/ 400 millones. “Además de los proyectos para reducir las emisiones de nuestras plantas, la inversión también alude a la construcción de un domo de almacenamiento de clinker con una capacidad de 115,000 toneladas métricas a lo que se sumaría dos canchas techadas adicionales. En total, en nuestra planta de Atocongo vamos a tener una capacidad de almacenamiento de 325,000 toneladas métricas, de modo de optimizar la capacidad de nuestra bodega, proteger la calidad de nuestro clinker y, finalmente, mejorar la eficiencia de nuestra operación”, finalizó. ",2025-05-31T21:04:00-05:00,https://gestion.pe/economia/empresas/el-nuevo-centro-de-unacem-tras-finalizar-despachos-a-jorge-chavez-y-puerto-de-chancay-noticia/
SUNAT traslada punto de devolución del IGV al nuevo Aeropuerto Jorge Chávez,Economía,Se busca mejorar la experiencia de los pasajeros y modernizar los servicios ofrecidos en el principal punto de entrada y salida del país.,"A partir del 1 de junio, la Superintendencia Nacional de Aduanas y de Administración Tributaria (SUNAT) pondrá en funcionamiento su nuevo puesto de control para la devolución del IGV a turistas extranjeros en la zona de preembarque del tercer piso del renovado terminal del Aeropuerto Internacional Jorge Chávez.La medida fue oficializada mediante la Resolución de Superintendencia N.º 176-2025/SUNAT, publicada este jueves en el diario oficial, y se da en el marco del inicio de operaciones del nuevo terminal aeroportuario, que busca mejorar la experiencia de los pasajeros y modernizar los servicios ofrecidos en el principal punto de entrada y salida del país.El beneficio de devolución del IGV está dirigido a los visitantes no domiciliados en el Perú que hayan adquirido bienes en establecimientos afiliados al sistema “Tax Free” y que emitan facturas electrónicas con dicha constancia. El trámite se debe realizar antes de salir del país, y en el nuevo espacio se podrá gestionar de forma más ágil y accesible.Una vez presentada la solicitud, y verificado el cumplimiento de los requisitos establecidos, SUNAT efectuará la devolución del impuesto en un plazo máximo de cinco días hábiles, mediante un abono en la tarjeta de crédito o débito registrada por el turista.Esta iniciativa forma parte de los esfuerzos de SUNAT, según lo establece en su comunicado, por fomentar el turismo receptivo y dinamizar el comercio local, facilitando incentivos tributarios que promuevan las compras de visitantes internacionales.",2025-05-31T17:16:23-05:00,https://gestion.pe/economia/sunat-traslada-punto-de-devolucion-del-igv-al-nuevo-aeropuerto-jorge-chavez-noticia/
